name,location,price,capacity,rating,reviews,description
Atlanta Botanical Garden,"Atlanta, GA",$$$,151-200 Guests,4.7,21,"An urban oasis nestled in the heart of Midtown, this property offers lush lawns, verdant tropical foliage, and outdoor event spaces."
Monday Night Brewing: The Garage,Metro Atlanta,$$$,300+ Guests,4.9,14,"A charming and inviting private event space with high ceilings, natural light, and historic charm."
Factory Atlanta,"Atlanta, GA",$$$,300+ Guests,5.0,6,An industrial-meets-chic venue perfect for creative couples.
Ambient + Studio,"Atlanta, GA",$$$,251-300 Guests,4.4,9,A unique wedding venue built in 1910 with a historic and artistic atmosphere.
Park Tavern: The Piedmont Room & Piedmont Garden Tent,"Atlanta, GA",$$$,251-300 Guests,4.7,132,"Overlooks Piedmont Park, offering indoor and outdoor spaces with city skylines and seasonal colors."
Grana,"Atlanta, GA",$$$,151-200 Guests,5.0,1,A warm and inviting setting with authentic Southern Italian cuisine and three levels of event space.
Journeyman's Hall,"Atlanta, GA",$$$,151-200 Guests,5.0,3,A wedding venue located in South Downtown Atlanta with a talented culinary team.
Hyatt Regency Atlanta Perimeter at Villa Christina,"Atlanta, GA",$$$,300+ Guests,4.6,63,Surrounded by 83 acres of landscaped gardens with captivating natural views.
Ecco Buckhead,"Atlanta, GA",$$$,300+ Guests,0.0,0,An elegant restaurant venue in the heart of Buckhead neighborhood.
The Kimpton Shane,"Atlanta, GA",$$$,51-100 Guests,0.0,0,A boutique hotel with stunning architecture and stylish furnishings.
FORTH Hotel Atlanta,"Atlanta, GA",$$$$,201-250 Guests,0.0,0,A deluxe wedding venue in the Old Fourth Ward with an elegant ballroom and rooftop space.
Wahoo! Grill,"Decatur, GA",$$$,201-250 Guests,5.0,100,A full-service wedding venue with outstanding staff and a relaxing atmosphere.
The White Bull,"Decatur, GA",$$$,51-100 Guests,0.0,0,A restaurant wedding venue specializing in Italian farm-to-table cuisine.
Emory Conference Center Hotel,"Atlanta, GA",$$$,300+ Guests,4.8,41,An elegant venue with unique surroundings and convenient location.
Callanwolde Fine Arts Center,"Atlanta, GA",$$$,151-200 Guests,4.6,38,A unique wedding venue with a century-long legacy in Druid Hills.
The Wimbish House,"Atlanta, GA",$$$,201-250 Guests,4.9,85,A Victorian-era home in Midtown with nearly a century of wedding history.
Historic DeKalb Courthouse,"Decatur, GA",$$$,101-150 Guests,4.9,92,An elegant courthouse with white marble and 20-foot ceilings.
SCAD Ivy Hall,"Atlanta, GA",$$$,101-150 Guests,4.5,4,A historic wedding venue designed by renowned architect Gottfried L. Norrman.
The Westside Warehouse,"Atlanta, GA",$$$,201-250 Guests,5.0,37,A converted warehouse with cathedral ceilings in a creative district.
Renaissance Atlanta Midtown Hotel,Midtown Atlanta,$$$,300+ Guests,5.0,2,A hotel in the arts and music district with a prime location.
Wrecking Bar Brewpub,"Atlanta, GA",$$$,201-250 Guests,5.0,9,A historic mansion with Victorian-era architecture.
Grand Hyatt Atlanta in Buckhead,"Atlanta, GA",$$$,300+ Guests,5.0,4,An urban retreat with tenured staff for unforgettable events.
Intercontinental Buckhead Atlanta,"Atlanta, GA",$$$,300+ Guests,5.0,8,A hotel combining classic charm with modern luxury.
Epicurean Hotel Atlanta,"Atlanta, GA",$$$,101-150 Guests,5.0,3,A luxe and lavish venue with sleek modern architecture.
THE TROLLEY BARN,"Atlanta, GA",$$$,201-250 Guests,4.2,41,A historic structure with hardwood floors and garden area.
Hotel Colee,"Atlanta, GA",$$$,251-300 Guests,0.0,0,An award-winning hotel with modern development and redevelopment.
Waldorf Astoria Atlanta Buckhead,"Atlanta, GA",$$$$,51-100 Guests,4.9,7,A luxurious venue with Southern charm in a prestigious neighborhood.
Omni Atlanta Hotel at Centennial Park,"Atlanta, GA",$$$,300+ Guests,5.0,6,A hotel across from Centennial Olympic Park with banquet services.
42West Entertainment Group,"Atlanta, GA",$$$,251-300 Guests,5.0,6,A stunning gathering space with industrial modernity and refined elegance.
Renaissance Concourse Atlanta Airport Hotel,"Atlanta, GA",$$$,300+ Guests,0.0,0,An elegant hotel combining luxury and convenience for weddings.
Swan Coach House,"Atlanta, GA",$$,101-150 Guests,5,7,"Swan Coach House is an elegant wedding venue in Atlanta, GA. Originally part of Atlanta’s famed Inman family estate, the Swan Coach House is a historic space in the residential heart of Buckhead."
Enon Ranch,"Atlanta, GA",$$,251-300 Guests,5,2,"Enon Ranch is a beautiful wedding venue located in Atlanta, GA. This rustic event space offers countryside views and a space for love, celebration, and cherished moments to bloom."
Pristine Chapel Lakeside,"Jonesboro, GA",$$,251-300 Guests,4.8,103,Pristine Chapel Lakeside is a luxe ceremony and reception venue offering sweeping views and virtual tours.
Brick and Ivey,"Marietta, GA",$$,151-200 Guests,5,100,"Brick and Ivey is North Atlanta’s newest wedding venue with exposed white brick walls, bridal suites, and separate event spaces."
Kimball Hall,"Roswell, GA",$$,151-200 Guests,5,162,Kimball Hall is a newly renovated venue with indoor and outdoor ceremony sites and a brand new outdoor courtyard.
Stanley House Mansion,"Marietta, GA",$$,101-150 Guests,5,48,Stanley House Mansion is a stunning historic wedding venue with classic Southern charm.
The Atrium,"Norcross, GA",$$,101-150 Guests,4.9,151,The Atrium is a contemporary wedding venue with a mezzanine level overlooking a two-story glass atrium.
Primrose Cottage,"Roswell, GA",$$,300+ Guests,4.9,272,Primrose Cottage is an enchanting three-story home situated on a stately front lawn in Historic Roswell.
Roswell Historic Hall,"Roswell, GA",$$,300+ Guests,4.3,49,Roswell Historic Hall is a versatile event venue hosting various events including weddings and corporate parties.
Naylor Hall,"Roswell, GA",,201-250 Guests,5,173,"Naylor Hall is a grand historic venue with a modern makeover, perfect for elegant celebrations."
Country Club of Roswell,"Roswell, GA",$$,201-250 Guests,4.7,23,Country Club of Roswell offers flexible event spaces for both intimate and large-scale receptions.
Vecoma At The Yellow River,"Snellville, GA",$$,251-300 Guests,4.9,199,Vecoma at the Yellow River is an all-inclusive wedding venue nestled on 70 acres of lush forest.
Little Gardens,"Lawrenceville, GA",$$,251-300 Guests,4.9,215,Little Gardens is a serene wedding venue featuring a manor house and lavish green grounds.
Flint Hill,"Norcross, GA",$$,251-300 Guests,4.8,205,Flint Hill is a beautifully restored historic mansion with landscaped grounds and a covered pavilion.
Ivy Hall,"Roswell, GA",$$$,201-250 Guests,4.9,89,Ivy Hall is a historic venue with a blend of Southern history and modern amenities.
Olde Towne Special Events,"Atlanta, GA",$$,251-300 Guests,5,66,Olde Towne Special Events is a full-service events facility with a stylish backdrop for wedding festivities.
Whitestone Reserve,"Austell, GA",$$,101-150 Guests,5,21,Whitestone Reserve is a stunning new venue with chandeliers and natural lighting.
The 173 Carlyle House,"Norcross, GA",$$,300+ Guests,4.8,109,The 173 Carlyle House is a turn-of-the-century mansion with two acres of manicured grounds.
The Foxglove,"Marietta, GA",$$,300+ Guests,5,3,The Foxglove is a characterful venue in the heart of Marietta’s historic district.
Brumby Hall & Gardens,"Marietta, GA",$$,151-200 Guests,4,2,Brumby Hall & Gardens is a historic wedding venue surrounded by meticulously kept gardens.
Roswell Mill Club,"Roswell, GA",$$,151-200 Guests,4.8,41,Roswell Mill Club is a historic venue with a blend of Southern history and modern event capabilities.
The Reserves at Hamilton Homes,"Mableton, GA",$$$,101-150 Guests,5,1,The Reserves at Hamilton Homes offers gorgeous sunset views and timeless interiors.
Eden Garden House,"Lithonia, GA",$$$,151-200 Guests,,,Eden Garden House is a beautiful garden venue with renovated facilities for special events.
Huntcliff River Club,"Atlanta, GA",$$,101-150 Guests,4.9,30,Huntcliff River Club is a charming venue surrounded by river oaks and manicured lawns.
Chattahoochee Nature Center,"Roswell, GA",$$,151-200 Guests,4.8,38,"Chattahoochee Nature Center is a natural wedding venue nestled in Roswell, GA."
Westin Atlanta Airport,"Atlanta, GA",,300+ Guests,4,4,Westin Atlanta Airport is a convenient wedding venue near Hartsfield-Jackson International Airport.
The Cotton Gin at Mill Creek,"Hiram, GA",$$,151-200 Guests,5,96,The Cotton Gin at Mill Creek is an all-inclusive wedding venue with a no-fee guarantee.
Ashton Gardens Atlanta by Walters Wedding Estates,"Sugar Hill, GA",$$$,251-300 Guests,4.8,477,Ashton Gardens Atlanta is a premier wedding venue with a signature glass chapel.
Conservatory at Waterstone,"Acworth, GA",$$,201-250 Guests,4.9,102,Conservatory at Waterstone is a historic banquet hall offering all-inclusive wedding solutions.
Little River Farms,"Alpharetta, GA",$$,201-250 Guests,4.9,188,Little River Farms is a peaceful retreat with elegant event spaces.
The Wildflower Barn at Little River Farms,"Alpharetta, GA",$,101-150 Guests,5,81,"A historic, family-owned barn renovated for weddings and special events, featuring an all-white painted exterior and distressed white brick wall."
Payne Corley House,"Duluth, GA",$$,151-200 Guests,5,190,A restored farmhouse offering a tranquil retreat for celebrations with picturesque grounds year-round.
SomeTheme Weddings & Events,Metro Atlanta and Surrounding Areas,$$$,51-100 Guests,5,6,"A venue offering timeless elegance without feeling stuffy, featuring 11 ft windows and modern amenities."
Venue 92,"Woodstock, GA",$$,151-200 Guests,4.9,89,"A flexible venue that can accommodate romantic gardens, glamorous evenings, or lively parties."
Foxhall Resort,"Douglasville, GA",$$$,201-250 Guests,4.2,63,"A picturesque resort on 1,100 acres offering a full weekend wedding experience with various amenities."
The Grande At Kennesaw,"Kennesaw, GA",$$,201-250 Guests,4,10,A charming Victorian-style farmhouse with stunning landscaped gardens for a romantic backdrop.
TPC Sugarloaf,"Duluth, GA",$$$,201-250 Guests,5,36,"An elegant clubhouse overlooking a championship golf course, perfect for sophisticated weddings."
Douglasville Conference Center,"Douglasville, GA",$$,300+ Guests,3,1,A conference center with elegant spaces and exemplary service for large-scale events.
Governors Towne Club,"Acworth, GA",$$,201-250 Guests,4.2,13,An elegant event venue with a pristine golf course and sophisticated spaces near Atlanta.
Genesis Ballroom,Atlanta Metropolitan Area,$$,251-300 Guests,,,"An opulent wedding venue blending elegance, contemporary, and industrial styles for lavish events."
Hilton Alpharetta Atlanta,"Alpharetta, GA",$$,251-300 Guests,5,1,A full-service Hilton hotel offering modern amenities for sophisticated weddings.
Vines Mansion & Gardens,"Loganville, GA",$$,300+ Guests,4.6,31,"A mansion with an open vendor policy, allowing couples to bring their own vendors for flexibility."
Hazlehurst House,"McDonough, GA",$$,251-300 Guests,4.8,54,"A wedding venue on three acres of private land, offering both indoor and outdoor spaces."
Cherry Hollow Farm,"Chattahoochee Hills, GA",$$,151-200 Guests,5,6,"A unique indoor/outdoor venue with two bars, a stage, and dressing rooms for events."
Kite Manor Events & Studio,"Fayetteville, GA",$$$,51-100 Guests,,,"A charming venue with modern indoor and rustic outdoor spaces, including a pool."
Atlanta Marriott Alpharetta,"Alpharetta, GA",$$,300+ Guests,5,1,A luxurious hotel venue in the heart of Alpharetta for sophisticated events.
Breckinridge Banquet Hall,"Duluth, GA",$$,101-150 Guests,4.8,27,An upscale venue for intimate gatherings to large-scale wedding receptions.
Atlanta Cosmopolitan Event Center,"Douglasville, GA",,,0,0,A wedding venue offering comprehensive services for dream wedding events.
St Ives Country Club,"Johns Creek, GA",$$$,201-250 Guests,4.7,14,A stunning country club with a clubhouse on one of Atlanta's highest points.
The Wheeler House and Barn,"Ball Ground, GA",$$,251-300 Guests,4.9,117,"A rustic barn with Southern charm, perfect for countryside celebrations."
Carl House,"Auburn, GA",$$$,201-250 Guests,4.8,185,A historic home offering elegant wedding celebrations with beautiful grounds.
Vinewood Stables,"Newnan, GA",$$$,201-250 Guests,4.9,88,A historic homestead with a farmhouse as its centerpiece for idyllic weddings.
Lanier Islands Weddings,"Buford, GA",$$$,300+ Guests,4.7,170,A venue offering various options for weddings with breathtaking backdrops.
The Venue at Stillwater Pond,"Temple, GA",$$,151-200 Guests,,,A stunning venue on 53 acres with views of forests and green pastures.
Koury Farms Weddings & Events,"Auburn, GA",$$,151-200 Guests,5,110,A unique venue offering detailed planning and a rustic setting.
The Engine Room,"Monroe, GA",,300+ Guests,4.9,32,A historic venue with modern convenience for elegant weddings.
In The Woods,"Rockmart, GA",$$$,201-250 Guests,5,23,"A state-of-the-art wedding venue on a secluded, family-owned property."
Lillian Gardens,"Newnan, GA",$$$,151-200 Guests,5,37,A full-service event venue with a mansion and gardens for unique experiences.
Bradford House and Gardens,"Flowery Branch, GA",$$,101-150 Guests,5,42,A classic Southern home on seven acres near Lake Lanier for all-inclusive weddings.
Fendley Farmstead LLC,"Canton, GA",$$,151-200 Guests,5,114,A picturesque farm venue with historic settings and expansive pastures.
Four Oaks Manor,"Buford, GA",$$,101-150 Guests,4.7,50,A historic farmhouse wedding venue with beautiful gardens and outdoor spaces.
Hi-Def Events,"Avondale, GA",$$,251-300 Guests,5,11,"A modern event venue with two locations, ideal for wedding celebrations near Atlanta."
Mystic Acres Barn,"Griffin, GA",$$,251-300 Guests,0,0,A beautiful barn wedding venue on a family farm with rustic charm.
The Gathering at Golden Creek,"Bremen, GA",$$$,201-250 Guests,0,0,A peaceful wedding venue with multiple event spaces on 23 acres of property.
Cherokee County Conference Center @ The Bluffs,"Canton, GA",$$$,251-300 Guests,5,3,A conference center with multiple event spaces and advanced technology.
"The Venue at Sharp Mountain, LLC","Jasper, GA",$$$,251-300 Guests,5,53,An award-winning wedding venue with historic charm and natural beauty.
The Willows Farm,"Marble Hill, GA",$$,201-250 Guests,5,96,A picturesque country event venue nestled in rolling hills.
The Farm at Rivers Edge,"Dawsonville, GA",$$,51-100 Guests,0,0,A riverfront wedding venue on 32 acres of farmland.
White Laurel Estate,"Dawsonville, GA",$$$,151-200 Guests,5,39,A former equestrian farm turned wedding venue with onsite accommodations.
Sage Cottage,"Adairsville, GA",$$,151-200 Guests,4.6,11,A cozy cottage-style wedding venue with wooded acres.
The Georgia Club,"Statham, GA",$$$,251-300 Guests,4.8,5,A one-of-a-kind wedding venue with garden and indoor spaces.
Harrells Vineyard,"Newnan, GA",$$,300+ Guests,0,0,A serene vineyard wedding venue with Southern charm.
Beautiful Beginnings Farm,"Newborn, GA",$,101-150 Guests,5,133,A charming farm wedding venue owned by a married couple.
Hightower Falls,"Cedartown, GA",$$,251-300 Guests,4.9,92,A picturesque wedding venue with a natural waterfall.
The Tate House,"Tate, GA",$$$,201-250 Guests,4.9,34,A historic mansion wedding venue with marble construction.
Magnolia Creek Farms,"Adairsville, GA",$$$,300+ Guests,5,5,A countryside wedding venue with 170 acres of grounds.
Spring Lake Events,"Rockmart, GA",$$,151-200 Guests,5,20,A lakefront wedding venue with willow trees and cattails.
Barn South,"Talmo, GA",$$,201-250 Guests,5,11,A luxury Southern destination with natural character.
Downtown Moreland Mill,"Moreland, GA",$$,201-250 Guests,5,2,A historic venue with old-world charm and a museum setting.
Autumn Oaks of Winder,"Winder, GA",$$,101-150 Guests,5,2,A charming wedding venue in the heart of Winder.
"Thompson House & Gardens, 9 Oaks Farm, & 2425 Warehouse","Monroe, GA",$$,151-200 Guests,4.9,68,A Victorian home with gardens and elegant event spaces.
Swan Lake Overlook,"Dawsonville, GA",$$$,251-300 Guests,5,11,A modern and elegant wedding venue with natural landscape.
Gaither's at Myrtle Creek Farm,"Covington, GA",$$,151-200 Guests,5,3,A historic farm wedding venue with rolling hills.
The Sixty Two,"Madison, GA",$$,151-200 Guests,5,2,A unique wedding venue with luxurious spaces.
2400 On The River,"Ranger, GA",$$$,201-250 Guests,4.9,35,A rustic riverfront wedding venue in the Appalachian foothills.
1051 Baxter,"Athens, GA",$$,251-300 Guests,5,1,A brand new events facility in the heart of Athens.
The Chapel Athens,"Athens, GA",$$$,251-300 Guests,5,17,A pristine downtown estate for weddings and events.
Juliette Chapel,"Dahlonega, GA",$$,51-100 Guests,5,36,An intimate wedding chapel ideal for smaller celebrations.
Twin Ponds at Riverbend,"Plainville, GA",$$,151-200 Guests,5,1,A breathtaking wedding venue with a relaxed atmosphere.
"Bogle Farm, LLC","Greenville, GA",$$$,251-300 Guests,4.9,45,An award-winning wedding venue with natural beauty.
Falling Waters Mountain Lodge,"Ellijay, GA",$$,101-150 Guests,5,1,A rural retreat and wedding venue located near Ellijay and Atlanta.
Summit Farm Weddings,"Ellijay, Blue Ridge, Dawsonville",$$,101-150 Guests,4.9,112,An enchanting countryside event venue with panoramic views of the Appalachian Mountains.
Ivy & Oak,"Talking Rock, GA",$$,151-200 Guests,5,35,A chic and elegant venue nestled in the North Georgia mountains.
255 Milledge | Hardeman-Sams Estate,"Athens, GA",$$$,151-200 Guests,4.9,118,"A historic estate offering extraordinary celebrations in Athens, Georgia."
Georgian Hall,"Athens, GA",$$$,201-250 Guests,5,103,An elegant historic location for wedding ceremonies and receptions.
Ott Vineyards and Winery,"Ellijay, GA",,,0,0,A family-owned vineyard and winery offering scenic views for weddings.
27 on Park,"Dahlonega, GA",$$$,51-100 Guests,5,3,A boutique hotel offering serenity and city charm in the North Georgia mountains.
Strawberry Roan Farm's Barn,"Dahlonega, GA",$$,101-150 Guests,5,1,A rustic-chic barn perfect for beginning your marriage journey.
The Venue on Broad,"Athens, GA",$$,201-250 Guests,5,4,A unique venue fusing an old New Orleans vibe with industrial architecture.
The Lodge at Taylor Estate,"Rome, GA",,Up to 350 Guests,5,2,An elegant venue with bi-fold doors offering indoor and outdoor elegance.
The Falls at Blue Ridge,"Blue Ridge, GA",$$$$,251-300 Guests,4.3,4,A stunning wedding venue offering breathtaking views and rustic-luxury spaces.
CeNita Venue at CeNita Vineyards & Winery,"Cleveland, GA",$$,151-200 Guests,5,73,A wedding venue overlooking vineyards in the Northeast Georgia Mountains.
South Elm Events,"Commerce, GA",$$,101-150 Guests,5,1,A venue offering a fairytale wedding experience with elegant receptions.
Cloverleaf Farm,"Arnoldsville, GA",$$,300+ Guests,4.9,72,A stunning farm venue with unexpected furnishings and incredible surroundings.
Yonah Mountain Vineyards,"Cleveland, GA",$$$,201-250 Guests,4.9,49,A charming venue offering indoor and outdoor spaces for romantic weddings.
The Venue at Grant Hill Farms,"Commerce, GA",$$,201-250 Guests,5,68,A peaceful farmland venue for weddings and events.
Cormiston Farms,"Clarkesville, GA",$$$,101-150 Guests,5,4,A scenic country wedding venue in the Nacoochee Valley.
Enotah Valley Event Center,"Blairsville, GA",$$,51-100 Guests,5,5,A rustic setting for weddings with a serene mountain backdrop.
Fall Line Station,"Macon, GA",$$$,300+ Guests,4.9,13,An industrial-chic wedding venue with included ceremony chairs and decor.
Valhalla Resort Hotel,"Helen, GA",$$,51-100 Guests,5,2,An elegant resort reminiscent of an Old World Scottish Castle.
Wynnewood Grove,"Lexington, GA",$$,251-300 Guests,0,0,A historic and romantic wedding venue on a ten-acre farm.
McEachin Farm,"Danielsville, GA",$$,101-150 Guests,5,2,A stunning wedding venue for celebrations and special events.
Butler Hall Events,"Gray, GA",$$,201-250 Guests,5,1,A historic wedding venue with a modern event facility.
Brasstown Valley Resort & Spa,"Young Harris, GA",$$$,151-200 Guests,4.9,79,"A resort offering mountain views, golf, and a full-service spa."
Overlook 55,"Young Harris, GA",$$$$,151-200 Guests,5,7,A venue blending rustic charm with timeless elegance.
Walnut Hill Farm,"Dalton, GA",$$,300+ Guests,4.8,16,A farm offering classic Southern elegance with mountain views.
The Estate at Stone Creek,"Macon, GA",$$$,201-250 Guests,4.8,5,A historic estate with beautiful landscapes for weddings.
The Ridges Resort on Lake Chatuge,"Hiawassee, GA",$$$,201-250 Guests,4.9,46,A lakeside mountain resort with a grand ballroom.
Lake Rabun Hotel & Restaurant,"Lakemont, GA",$$,101-150 Guests,5,2,A wedding venue with open-air decks and wood-burning fireplaces.
Bend of The River,"Hiawassee, GA",$$,,0,0,A tranquil wedding venue on Lake Chatuge with natural beauty.
Rustic Vows,"Mineral Bluff, GA",$$,51-100 Guests,0,0,"Situated in Mineral Bluff, GA, Rustic Vows offers an idyllic barn-style setting for creating bespoke wedding events that leave lasting memories."
Currahee Club,"Toccoa, GA",$$$,101-150 Guests,5,10,"Nestled in the North Georgia mountains, the Currahee Club features serene lake and mountain views offering a unique blend of sophistication and rustic charm."
Meadows at Mossy Creek,"Cleveland, GA",$$$$,251-300 Guests,5,39,"Meadows at Mossy Creek is a wedding reception venue located in Cleveland, GA. This stylish and contemporary property is an ideal place for couples to host their big-day celebrations."
The Dogwood Barn at G5Ranch,"Milledgeville, GA",$$$,300+ Guests,5,16,"Situated on over 600 acres in Milledgeville, Georgia, The Dogwood Barn is a premier wedding venue ideal for rustic romantic events."
Hawkesdene,"Andrews, NC",$$$,101-150 Guests,5,58,"Hawkesdene is a Private Mountain Estate located in Andrews, NC in the mountains of Western North Carolina."
Tryphena's Garden,"Fort Valley, GA",$$,151-200 Guests,4.9,18,"The Venue at Tryphena's Garden is a fairytale-like wedding and events venue in Fort Valley, Georgia."
Splendor Mountain,"Tiger, GA",$$,51-100 Guests,4.7,27,"Splendor Mountain is the perfect venue for an intimate wedding ceremony and reception in Tiger, GA."
Windsong Willows,"Hayesville, NC",$$,101-150 Guests,5,3,"Nestled in the valley of the Blue Ridge Mountains, Windsong Willows is a charming new wedding venue in Hayesville, NC."
Cloudland at McLemore Resort,"Rising Fawn, GA",$$$,251-300 Guests,4.2,6,"Your Dream Wedding, Above the Clouds At 2,300 feet above sea level, Cloudland at McLemore Resort on Lookout Mountain is a magical escape."
Skull Shoals Park,"Washington, GA",$$,300+ Guests,0,0,"Located in Historic Washington, GA, we offer several options to choose from for your special day."
Tiger Mountain Vineyards,"Tiger, GA",$$$,101-150 Guests,5,1,"Nestled in the Blue Ridge Mountains, Tiger Mountain Vineyards offers a charming and intimate setting for your outdoor wedding."
Kingsland Farm,"Hawkinsville, GA",$$,151-200 Guests,5,1,"Kingsland Farm is a picturesque and reclusive wedding venue in Hawkinsville, GA, surrounded by calm rural beauty."
Forest Hill Park,"Perry, GA",$$,51-100 Guests,4.9,21,"Have a beautiful ceremony in a picturesque 1920's white wedding chapel, get dressed in our red train car with your wedding party."
The Icehouse Dublin,"Dublin, GA",$$,300+ Guests,0,0,"The Icehouse Dublin in Dublin, GA, is a unique wedding venue blending Southern style with urban flair."
The Partridge Inn,"Augusta, GA",$$$,101-150 Guests,3.7,3,"The Partridge Inn is a wedding venue located in Augusta, GA, providing an elegant, timelessly beautiful setting."
Padgett's Farm,"Waynesboro, GA",$$,251-300 Guests,5,1,"Padgett's Farm is a gem of a wedding venue nestled on 610 acres of breathtaking nature in Waynesboro, GA."
Augusta Marriott Hotel & Suites,"Augusta, GA",$$,300+ Guests,4.3,6,Augusta Marriott at the Convention Center is a hotel and wedding venue nestled on the Savannah River waterfront.
Quinney Oaks Plantation,"Millen, GA",$$,300+ Guests,4.8,18,"Our event & wedding venue can make each and every occasion feel special, from wedding ceremonies to special luncheons."
